[
  {
    "id": "sg-001",
    "type": "single",
    "stem": "《三国演义》第一回中，刘备自称是汉室宗亲，他的表字是什么？",
    "options": {
      "A": "玄德",
      "B": "孟德",
      "C": "仲谋",
      "D": "伯约"
    },
    "answer": "A",
    "analysis": "第一回写刘备出身：「中山靖王刘胜之后，汉景帝阁下玄孙：姓刘，名备，字玄德。」后面还交代他「家贫，贩屦织席为业」。孟德是曹操的字，仲谋是孙权的字，伯约是姜维的字。",
    "difficulty": 1,
    "category": "人物字号",
    "tags": [
      "刘备",
      "字",
      "第一回"
    ],
    "source": {
      "chapter": 1,
      "scene": "桃园结义·刘备出身",
      "evidence": "中山靖王刘胜之后，汉景帝阁下玄孙：姓刘，名备，字玄德。"
    }
  },
  {
    "id": "sg-002",
    "type": "single",
    "stem": "《三国演义》第一回关羽自报家门，说自己「字长生，后改云长」，那么他最初的字是什么？",
    "options": {
      "A": "翼德",
      "B": "汉升",
      "C": "云长",
      "D": "长生"
    },
    "answer": "D",
    "analysis": "第一回关羽自报：「吾姓关，名羽，字长生，后改云长，河东解良人也。」后来人皆称其字云长。云长是关羽，翼德是张飞，汉升是黄忠。",
    "difficulty": 2,
    "category": "人物字号",
    "tags": [
      "关羽",
      "字",
      "第一回"
    ],
    "source": {
      "chapter": 1,
      "scene": "桃园结义·关羽自报家门",
      "evidence": "吾姓关，名羽，字长生，后改云长，河东解良人也。"
    }
  },
  {
    "id": "sg-003",
    "type": "single",
    "stem": "《三国演义》第一回中，张飞自报家门，说的是哪一句？",
    "options": {
      "A": "某姓张，名飞，字云长；世居涿郡，卖酒屠猪",
      "B": "某姓张，名飞，字翼德，燕人，身长八尺余",
      "C": "某姓张，名飞，字翼德，河东解良人也",
      "D": "某姓张，名飞，字翼德；世居涿郡，颇有庄田，卖酒屠猪"
    },
    "answer": "D",
    "analysis": "第一回原文：「某姓张，名飞，字翼德。世居涿郡，颇有庄田，卖酒屠猪，专好结交天下豪杰。」他并没有说自己是燕人——「燕人张飞在此」是第五回他与吕布交战时的喝话。",
    "difficulty": 2,
    "category": "人物字号",
    "tags": [
      "张飞",
      "字",
      "第一回"
    ],
    "source": {
      "chapter": 1,
      "scene": "桃园结义·张飞自报家门",
      "evidence": "某姓张，名飞，字翼德。世居涿郡，颇有庄田，卖酒屠猪。"
    }
  },
  {
    "id": "sg-004",
    "type": "single",
    "stem": "刘备三顾茅庐所请的“卧龙先生”，他的表字是什么？",
    "options": {
      "A": "孔明",
      "B": "士元",
      "C": "公瑾",
      "D": "伯约"
    },
    "answer": "A",
    "analysis": "第三十六回徐庶举荐：「此人乃琅琊阳都人，复姓诸葛，名亮，字孔明……因自号为卧龙先生。」士元是庞统的字，公瑾是周瑜的字，伯约是姜维的字。",
    "difficulty": 1,
    "category": "人物字号",
    "tags": [
      "诸葛亮",
      "三顾茅庐",
      "字"
    ],
    "source": {
      "chapter": 36,
      "scene": "徐庶走马荐诸葛",
      "evidence": "此人乃琅琊阳都人，复姓诸葛，名亮，字孔明。"
    }
  },
  {
    "id": "sg-005",
    "type": "single",
    "stem": "长坂坡单骑救主的那位常山赵子龙，他的表字和籍贯是？",
    "options": {
      "A": "字云长，常山真定人也",
      "B": "字子龙，常山真定人也",
      "C": "字翼德，常山真定人也",
      "D": "字子龙，河东解良人也"
    },
    "answer": "B",
    "analysis": "第七回赵云自报：「某乃常山真定人也：姓赵，名云，字子龙；本袁绍辖下之人。」解良是关羽籍贯，云长是关羽的字，翼德是张飞的字。",
    "difficulty": 1,
    "category": "人物字号",
    "tags": [
      "赵云",
      "字",
      "长坂坡"
    ],
    "source": {
      "chapter": 7,
      "scene": "公孙瓒麾下·赵子龙初出",
      "evidence": "某乃常山真定人也：姓赵，名云，字子龙。"
    }
  },
  {
    "id": "sg-006",
    "type": "single",
    "stem": "《三国演义》中西凉锦马超的表字是什么？",
    "options": {
      "A": "字孟起，扶风茂陵人也",
      "B": "字文远，扶风茂陵人也",
      "C": "字孟起，河东解良人也",
      "D": "字子龙，扶风茂陵人也"
    },
    "answer": "A",
    "analysis": "第十回马腾举义时，原著交代「那将即马腾之子马超，字孟起，年方十七岁，英勇无敌」。子龙是赵云字，翼德是张飞字，文远是张辽字。",
    "difficulty": 1,
    "category": "人物字号",
    "tags": [
      "马超",
      "字"
    ],
    "source": {
      "chapter": 10,
      "scene": "马腾举义·马超字孟起",
      "evidence": "那将即马腾之子马超，字孟起，年方十七岁，英勇无敌。"
    }
  },
  {
    "id": "sg-007",
    "type": "single",
    "stem": "徐庶向刘备举荐的“凤雏”，也就是后来献连环计、殒命落凤坡的军师，他的表字是什么？",
    "options": {
      "A": "士元",
      "B": "孔明",
      "C": "元直",
      "D": "公达"
    },
    "answer": "A",
    "analysis": "庞统即徐庶所举的「凤雏」。第四十七回周瑜问计，原著交代「原来襄阳庞统，字士元，因避乱寓居江东」。孔明是诸葛亮字，士元是庞统字，元直是徐庶字，公达是荀攸字。",
    "difficulty": 1,
    "category": "人物字号",
    "tags": [
      "庞统",
      "凤雏",
      "字"
    ],
    "source": {
      "chapter": 47,
      "scene": "庞统巧授连环计·襄阳庞统字士元",
      "evidence": "原来襄阳庞统，字士元，因避乱寓居江东。"
    }
  },
  {
    "id": "sg-008",
    "type": "single",
    "stem": "《三国演义》中被诸葛亮称作“冢虎”、日后取代曹魏的谋臣，他的表字是？",
    "options": {
      "A": "奉孝",
      "B": "仲达",
      "C": "孝直",
      "D": "文若"
    },
    "answer": "B",
    "analysis": "第三十九回曹操罢三公之职，以司马懿为文学掾，书中交代「懿字仲达，河内温人也」。文若是荀彧字，奉孝是郭嘉字，孝直是法正字。",
    "difficulty": 2,
    "category": "人物字号",
    "tags": [
      "司马懿",
      "字",
      "后期"
    ],
    "source": {
      "chapter": 39,
      "scene": "曹操置司马懿为文学掾",
      "evidence": "懿字仲达，河内温人也。"
    }
  },
  {
    "id": "sg-009",
    "type": "single",
    "stem": "《三国演义》中人中吕布、马超的表字是？",
    "options": {
      "A": "奉先",
      "B": "伯约",
      "C": "子龙",
      "D": "汉升"
    },
    "answer": "A",
    "analysis": "吕布字奉先。子龙是赵云字，汉升是黄忠字，伯约是姜维字。",
    "difficulty": 1,
    "category": "人物字号",
    "tags": [
      "吕布",
      "字"
    ],
    "source": {
      "chapter": 3,
      "scene": "李肃说吕布",
      "evidence": "此丁原义儿：姓吕，名布，字奉先者也。"
    }
  },
  {
    "id": "sg-010",
    "type": "single",
    "stem": "《三国演义》中与孙策共事、后来在赤壁力主抗曹的东吴大都督，他的表字是？",
    "options": {
      "A": "子敬",
      "B": "公覆",
      "C": "公瑾",
      "D": "文长"
    },
    "answer": "C",
    "analysis": "第十五回孙策起兵途中遇周瑜：「策视其人，乃庐江舒城人：姓周，名瑜，字公瑾。」子敬是鲁肃字，公覆是黄盖字，文长是魏延字。",
    "difficulty": 1,
    "category": "人物字号",
    "tags": [
      "周瑜",
      "字",
      "赤壁"
    ],
    "source": {
      "chapter": 15,
      "scene": "孙策起兵·周瑜字公瑾",
      "evidence": "策视其人，乃庐江舒城人：姓周，名瑜，字公瑾。"
    }
  },
  {
    "id": "sg-011",
    "type": "single",
    "stem": "《三国演义》中被曹操称为“吾之子房”、一生以“王佐之才”自任的谋臣，他的表字是？",
    "options": {
      "A": "文长",
      "B": "德操",
      "C": "文若",
      "D": "仲达"
    },
    "answer": "C",
    "analysis": "第十回荀彧来投，曹操与之语大悦曰「此吾之子房也」，遂用为行军司马。文若是荀彧字，仲达是司马懿字，文长是魏延字，德操是刘表字。",
    "difficulty": 2,
    "category": "人物字号",
    "tags": [
      "荀彧",
      "字",
      "曹操谋臣"
    ],
    "source": {
      "chapter": 10,
      "scene": "曹操招贤纳士·荀彧来投",
      "evidence": "姓荀，名彧，字文若，荀昆之子也。"
    }
  },
  {
    "id": "sg-012",
    "type": "single",
    "stem": "曹操赤壁败后叹恨的那位谋臣、庙堂之上以“十胜十败之论”说服曹操的郭嘉，他的表字是？",
    "options": {
      "A": "元直",
      "B": "文若",
      "C": "奉孝",
      "D": "孝直"
    },
    "answer": "C",
    "analysis": "第十回程昱向荀彧举荐郭嘉：「公之乡人姓郭，名嘉，字奉孝，乃当今贤士，何不罗而致之？」文若是荀彧字，孝直是法正字，元直是徐庶字。",
    "difficulty": 2,
    "category": "人物字号",
    "tags": [
      "郭嘉",
      "字",
      "奉孝"
    ],
    "source": {
      "chapter": 10,
      "scene": "程昱举荐郭嘉·郭嘉字奉孝",
      "evidence": "公之乡人姓郭，名嘉，字奉孝，乃当今贤士。"
    }
  },
  {
    "id": "sg-013",
    "type": "single",
    "stem": "《三国演义》第一回，曹操少年时求访于名士许劭（许子将），许劭对他的评价是？",
    "options": {
      "A": "清平之奸贼，乱世之英雄",
      "B": "王佐之才，必可大用",
      "C": "一时之杰，千古之罪",
      "D": "治世之能臣，乱世之奸雄"
    },
    "answer": "D",
    "analysis": "第一回许劭（许子将）答曹操的话，原文是「子治世之能臣，乱世之奸雄也」，随后曹操「闻言大喜」。A 的「清平之奸贼，乱世之英雄」出自《后汉书·许劭传》，《三国演义》正文并未采用。",
    "difficulty": 1,
    "category": "人物生平",
    "tags": [
      "曹操",
      "许劭",
      "评价"
    ],
    "source": {
      "chapter": 1,
      "scene": "许劭评曹操",
      "evidence": "劭曰：「子治世之能臣，乱世之奸雄也。」"
    }
  },
  {
    "id": "sg-014",
    "type": "single",
    "stem": "《三国演义》中刘备自称是汉室宗亲，他所追溯的宗族始祖是？",
    "options": {
      "A": "汉高祖刘邦",
      "B": "淮南王刘安",
      "C": "中山靖王刘胜",
      "D": "长沙定王刘发"
    },
    "answer": "C",
    "analysis": "第一回原文：「中山靖王刘胜之后，汉景帝阁下玄孙：姓刘，名备，字玄德。」汉高祖刘邦、淮南王刘安都是真实的汉室宗亲，但与刘备这一支无关。",
    "difficulty": 1,
    "category": "人物生平",
    "tags": [
      "刘备",
      "身世"
    ],
    "source": {
      "chapter": 1,
      "scene": "桃园结义·刘备出身",
      "evidence": "中山靖王刘胜之后，汉景帝阁下玄孙：姓刘，名备，字玄德。"
    }
  },
  {
    "id": "sg-015",
    "type": "single",
    "stem": "《三国演义》中被封为“汉寿亭侯”的那位将领是谁？",
    "options": {
      "A": "黄忠",
      "B": "张飞",
      "C": "关羽",
      "D": "赵云"
    },
    "answer": "C",
    "analysis": "关羽斩颜良后，曹操倍加钦敬，表奏朝廷封其为汉寿亭侯并铸印送去。关羽后来辞曹时挂印封金，离开许都。",
    "difficulty": 1,
    "category": "人物生平",
    "tags": [
      "关羽",
      "汉寿亭侯",
      "封号"
    ],
    "source": {
      "chapter": 26,
      "scene": "关羽斩颜良·曹操封汉寿亭侯",
      "evidence": "曹操见云长斩了颜良，倍加钦敬，表奏朝廷，封云长为汉寿亭侯，铸印送关公。"
    }
  },
  {
    "id": "sg-016",
    "type": "single",
    "stem": "《三国演义》中关羽自报的籍贯“河东解良”，在书中指的是哪一处？",
    "options": {
      "A": "涿郡涿县",
      "B": "幽州涿郡",
      "C": "颍川郡",
      "D": "河东郡解良县"
    },
    "answer": "D",
    "analysis": "关羽是河东解良人。涿县是刘备张飞的乡里（涿郡），幽州涿郡是所在的大州名，颍川是荀彧荀攸荀谌的乡里。",
    "difficulty": 2,
    "category": "人物生平",
    "tags": [
      "关羽",
      "籍贯",
      "河东"
    ],
    "source": {
      "chapter": 1,
      "scene": "桃园结义·关羽自报家门",
      "evidence": "此人姓关，名羽，字云长，河东解良人也。"
    }
  },
  {
    "id": "sg-017",
    "type": "single",
    "stem": "《三国演义》中关羽被曹军射中毒箭，华佗前来医治，用的办法是什么？",
    "options": {
      "A": "以针灸封住毒经再拔毒",
      "B": "用尖刀割开皮肉直至于骨，刮去骨上的箭毒",
      "C": "放血敷药并静养三月",
      "D": "先灌麻沸散麻醉，再割肉开刀"
    },
    "answer": "B",
    "analysis": "第七十五回华佗（字元化）说：立一标柱钉大环，请关羽将臂穿入环中，以绳系之、被蒙其首，「吾用尖刀割开皮肉，直至于骨，刮去骨上箭毒，用药敷之，以线缝其口」。关羽饮酒食肉、谈笑弈棋，全无痛苦之色，帐上帐下见者皆掩面失色。原著这一段里并没有「麻沸散」——那是《后汉书·华佗传》中的记载。",
    "difficulty": 2,
    "category": "人物生平",
    "tags": [
      "关羽",
      "华佗",
      "刮骨疗毒",
      "三国演义"
    ],
    "source": {
      "chapter": 75,
      "scene": "关云长刮骨疗毒",
      "evidence": "佗曰：「吾用尖刀割开皮肉，直至于骨，刮去骨上箭毒，用药敷之，以线缝其口，方可无事。」"
    }
  },
  {
    "id": "sg-018",
    "type": "single",
    "stem": "《三国演义》中赤壁兵败后，曹操放声大哭、叹恨的谋臣是谁？",
    "options": {
      "A": "徐庶",
      "B": "荀彧",
      "C": "贾诩",
      "D": "郭嘉"
    },
    "answer": "D",
    "analysis": "第五十回曹操在曹仁营中仰天大恸：「吾哭郭奉孝耳！若奉孝在，决不使吾有此大失也！」奉孝是郭嘉的字。荀彧字文若，徐庶字元直——徐庶此时已投奔刘备，更不可能为曹操谋划。",
    "difficulty": 2,
    "category": "人物生平",
    "tags": [
      "曹操",
      "郭嘉",
      "赤壁"
    ],
    "source": {
      "chapter": 50,
      "scene": "赤壁兵败·曹操哭郭奉孝",
      "evidence": "吾哭郭奉孝耳！若奉孝在，决不使吾有此大失也！"
    }
  },
  {
    "id": "sg-019",
    "type": "single",
    "stem": "《三国演义》中徐庶举荐的“卧龙、凤雏”两位贤才，“凤雏”指的是谁？",
    "options": {
      "A": "诸葛亮",
      "B": "司马徽",
      "C": "黄忠",
      "D": "庞统"
    },
    "answer": "D",
    "analysis": "徐庶向刘备举荐：“卧龙、凤雏，二者得一可安天下。”卧龙是诸葛亮，凤雏是庞统。司马徽是二人的推荐人水镜先生。",
    "difficulty": 1,
    "category": "人物生平",
    "tags": [
      "庞统",
      "凤雏",
      "徐庶"
    ],
    "source": {
      "chapter": 36,
      "scene": "徐庶走马荐诸葛·凤雏伏龙",
      "evidence": "凤雏乃襄阳庞统也。伏龙正是诸葛孔明。"
    }
  },
  {
    "id": "sg-020",
    "type": "single",